{
  "schema_version": "1.0",
  "run_id": "a42e19f4-80a9-5f04-941c-6d3ae4437744",
  "stage_id": "analysis",
  "attempt": 1,
  "input_artifact_ids": [
    "493b4d03-ba3d-5ac1-8d96-bfbb97f9bf39"
  ],
  "contract_version": "1",
  "profile_id": "web-fastapi-react",
  "limits": {
    "max_calls": 1,
    "max_output_tokens": 8000,
    "timeout_seconds": 90,
    "max_critical_questions": 3
  }
}
