{
  "schema_version": "1.0",
  "run_id": "a42e19f4-80a9-5f04-941c-6d3ae4437744",
  "stage_id": "analysis",
  "attempt": 2,
  "input_artifact_ids": [
    "efc7ede1-e60f-5d99-a085-d6c10358738f",
    "09c6e07d-702a-5cd3-82bd-064979202600"
  ],
  "contract_version": "1",
  "profile_id": "web-fastapi-angular",
  "limits": {
    "max_calls": 1,
    "max_output_tokens": 8000,
    "timeout_seconds": 90,
    "max_critical_questions": 3
  }
}
